20240117,윤건영,세계일보,검찰의 ‘文 전 사위 압수수색’에 靑 출신 민주 의원들 “尹 정치보복 도 넘어”,"황 의원은 ""피의자도 아닌 참고인 신분 자택 압수수색은 전례를 찾기 어려운 일""이라며 ""의혹이 있다면 수사는 당연하지만, 사실상 마무리된 수사가 윤석열 대통령의 최측근이 전주지검장으로 가면서 분위기가 180도 바뀌었다""고 강조했다. 그리고는 ""검찰은 문재인 전 대통령의 전 사위뿐만 아니라 가족의 계좌까지 샅샅이 들여다보면서 털고 있다""며 ""계좌에 등장하는 사람까지 소환한다는데, 수사 목적이 진실규명이 아니라 괴롭히기인 말 그대로 정치 수사이자 전임 대통령을 겨냥한 정치보복""이라고 쏘아붙였다.
최근 대통령기록관 압수수색에 이은 최수규 전 중소벤처기업부 차관 조사 등 서씨의 ‘특혜 취업’ 의혹에 관한 검찰의 강도 높은 수사에 같은 당 윤건영 의원은 ""‘김건희 특검법’이 국회를 통과한 데 따른 ‘분풀이식’ 보복수사가 아닌지 의심하게 한다""고 주장했다.","최근 대통령기록관 압수수색에 이은 최수규 전 중소벤처기업부 차관 조사 등 서씨의 ‘특혜 취업’ 의혹에 관한 검찰의 강도 높은 수사에 같은 당 윤건영 의원은 ""‘김건희 특검법’이 국회를 통과한 데 따른 ‘분풀이식’ 보복수사가 아닌지 의심하게 한다""고 주장했다","""‘김건희 특검법’이 국회를 통과한 데 따른 ‘분풀이식’ 보복수사가 아닌지 의심하게 한다""",http://www.segye.com/content/html/2024/01/17/20240117514377.html,Y
20240117,윤건영,세계일보,검찰의 ‘文 전 사위 압수수색’에 靑 출신 민주 의원들 “尹 정치보복 도 넘어”,"최근 대통령기록관 압수수색에 이은 최수규 전 중소벤처기업부 차관 조사 등 서씨의 ‘특혜 취업’ 의혹에 관한 검찰의 강도 높은 수사에 같은 당 윤건영 의원은 ""‘김건희 특검법’이 국회를 통과한 데 따른 ‘분풀이식’ 보복수사가 아닌지 의심하게 한다""고 주장했다.
문재인 정부 청와대 국정상황실장 출신인 윤 의원은 ""윤석열 정부 2년 동안 전임 정부의 머리끝부터 발끝까지 탈탈 털고도 부족해 가족까지 거꾸로 세워 털 셈인가""라며 ""이렇게까지 해서 윤석열 정부가 얻고자 하는 것은 무엇인가""라고 물었다. 계속해서 ""법은 만인 앞에 평등해야 하며 지위고하를 막론하고 죄가 있다면 처벌받아야 하지만, 죄가 없다면 전임 대통령 가족이라는 이유만으로는 괴롭힘 당해서는 안 된다""면서 ""윤석열 대통령은 국민을 두려워하기 바란다""고 말했다.","문재인 정부 청와대 국정상황실장 출신인 윤 의원은 ""윤석열 정부 2년 동안 전임 정부의 머리끝부터 발끝까지 탈탈 털고도 부족해 가족까지 거꾸로 세워 털 셈인가""라며 ""이렇게까지 해서 윤석열 정부가 얻고자 하는 것은 무엇인가""라고 물었다  계속해서 ""법은 만인 앞에 평등해야 하며 지위고하를 막론하고 죄가 있다면 처벌받아야 하지만, 죄가 없다면 전임 대통령 가족이라는 이유만으로는 괴롭힘 당해서는 안 된다""면서 ""윤석열 대통령은 국민을 두려워하기 바란다""고 말했다","""윤석열 정부 2년 동안 전임 정부의 머리끝부터 발끝까지 탈탈 털고도 부족해 가족까지 거꾸로 세워 털 셈인가""  ""이렇게까지 해서 윤석열 정부가 얻고자 하는 것은 무엇인가""  ""법은 만인 앞에 평등해야 하며 지위고하를 막론하고 죄가 있다면 처벌받아야 하지만, 죄가 없다면 전임 대통령 가족이라는 이유만으로는 괴롭힘 당해서는 안 된다""  ""윤석열 대통령은 국민을 두려워하기 바란다""",http://www.segye.com/content/html/2024/01/17/20240117514377.html,Y
20240117,윤건영,중앙일보,"文 사위 압수수색에…민주당 ""'인디언 기우제' 하듯 정치수사""","이어 ""피의자도 아닌 참고인 신분인 사람의 자택을 압수수색하는 것은 전례를 찾기 어려운 일""이라며 ""의혹이 있다면 수사를 하는 것은 당연하지만 사실상 마무리된 수사를 윤석열 대통령 최측근이 전주지검장으로 가면서 분위기가 180도 바뀌었다""고 주장했다.
청와대 국정상황실장 출신인 윤 의원은 기자회견 직후 백브리핑에서 ""어제 있었던 문재인 전 대통령의 전 사위에 대한 압수수색은 과정에서도 불법적인 행위가 진행됐다""며 ""절차와 과정을 전혀 지키지 않았는데 현장에 압수수색을 청구했던 변호인이 이의 제기를 하고 서면으로도 그 사실을 지적했다""고 밝혔다.
특히 그는 ""당사자 휴대전화가 아닌 노모 휴대전화를, 사용한 지 6년이 지난 휴대전화까지 압수수색까지 하는 것은 정치보복 수사 그 이상도 그 이하도 아니다""며 ""특히 아들이 사용하는 태블릿까지 압수수색을 했다고 하는데 대명천지에 이런 일이 있을 수 있나. 망신주기 보복수사로밖에 이해될 수 없다""고 했다.","청와대 국정상황실장 출신인 윤 의원은 기자회견 직후 백브리핑에서 ""어제 있었던 문재인 전 대통령의 전 사위에 대한 압수수색은 과정에서도 불법적인 행위가 진행됐다""며 ""절차와 과정을 전혀 지키지 않았는데 현장에 압수수색을 청구했던 변호인이 이의 제기를 하고 서면으로도 그 사실을 지적했다""고 밝혔다  특히 그는 ""당사자 휴대전화가 아닌 노모 휴대전화를, 사용한 지 6년이 지난 휴대전화까지 압수수색까지 하는 것은 정치보복 수사 그 이상도 그 이하도 아니다""며 ""특히 아들이 사용하는 태블릿까지 압수수색을 했다고 하는데 대명천지에 이런 일이 있을 수 있나. 망신주기 보복수사로밖에 이해될 수 없다""고 했다","""어제 있었던 문재인 전 대통령의 전 사위에 대한 압수수색은 과정에서도 불법적인 행위가 진행됐다""  ""절차와 과정을 전혀 지키지 않았는데 현장에 압수수색을 청구했던 변호인이 이의 제기를 하고 서면으로도 그 사실을 지적했다""  ""당사자 휴대전화가 아닌 노모 휴대전화를, 사용한 지 6년이 지난 휴대전화까지 압수수색까지 하는 것은 정치보복 수사 그 이상도 그 이하도 아니다""  ""특히 아들이 사용하는 태블릿까지 압수수색을 했다고 하는데 대명천지에 이런 일이 있을 수 있나. 망신주기 보복수사로밖에 이해될 수 없다""",https://www.joongang.co.kr/article/25222684,Y
20240118,윤건영,세계일보,"‘울산시장 선거개입’ 조국·임종석 관여 의심… 檢, 물증 등 확보 총력","검찰이 재수사를 결정한 것은 검찰이 주장한 사실관계가 이처럼 1심에서 상당수 받아들여졌다는 판단에 따른 것이다. 검찰은 재수사를 통해 조 전 장관과 임 전 실장, 이 전 비서관이 하명 수사 등 선거개입 과정에 관여했는지를 집중 수사할 방침이다. 조 전 장관과 임 전 실장이 범행에 가담했다는 물증이나 핵심적인 진술을 확보하는 것이 관건이 될 것으로 보인다.
문재인정부 청와대 국정상황실장을 지낸 민주당 윤건영 의원은 이날 통화에서 ""본인들이 원하는 결론이 나올 때까지 100번이고, 1000번이고 재수사하고 괴롭히겠다는 것""이라고 주장했다. 반면 김기현 전 대표는 이날 울산시의회에서 기자회견을 열고 재수사와 관련해 ""인과응보이자 사필귀정""이라고 밝혔다.","문재인정부 청와대 국정상황실장을 지낸 민주당 윤건영 의원은 이날 통화에서 ""본인들이 원하는 결론이 나올 때까지 100번이고, 1000번이고 재수사하고 괴롭히겠다는 것""이라고 주장했다","""본인들이 원하는 결론이 나올 때까지 100번이고, 1000번이고 재수사하고 괴롭히겠다는 것""",http://www.segye.com/content/html/2024/01/18/20240118515637.html,Y
20240121,윤건영,세계일보,“경호 빙자한 폭력” vs “흠집 내기”… ‘강성희 강제 퇴장’에 여야 공방 과열,"당시 현장에 있었던 윤준병 의원은 ""대통령이 앞에 있을 때는 조용히 얘기했는데, 거리가 멀어지니까 들리게 하기 위해 더 크게 얘기했다""며 ""그런데 갑자기 대통령이 옆에 있지도 않은데 경호원들이 강 의원 입을 막기 시작해서 사지를 들어 들고 나갔다""고 설명했다. 그는 이어 ""국민의 대표자인 국회의원이 정상적으로 얘기할 수 있는 내용을 못하게 막았다""며 ""이것은 과잉경호가 아니고 경호를 빙자한 경호처의 완전한 불법 폭력 행위""라고 지적했다.
문재인정부에서 청와대 국정기획상황실장을 지낸 윤건영 의원은 ""대한민국 국민 한 사람이 입이 막혀 사지가 들려 나가면 그 자리에서 그러지 말라고 하는 것이 대통령의 모습""이라며 ""역대 정부는 진보든 보수든 경호에 있어 열린 경호를 표방했다. 윤석열정부는 각하 시절로 되돌아가는 것 같아 화가 나고 분통이 터진다""고 말했다.","문재인정부에서 청와대 국정기획상황실장을 지낸 윤건영 의원은 ""대한민국 국민 한 사람이 입이 막혀 사지가 들려 나가면 그 자리에서 그러지 말라고 하는 것이 대통령의 모습""이라며 ""역대 정부는 진보든 보수든 경호에 있어 열린 경호를 표방했다. 윤석열정부는 각하 시절로 되돌아가는 것 같아 화가 나고 분통이 터진다""고 말했다","""대한민국 국민 한 사람이 입이 막혀 사지가 들려 나가면 그 자리에서 그러지 말라고 하는 것이 대통령의 모습""  ""역대 정부는 진보든 보수든 경호에 있어 열린 경호를 표방했다. 윤석열정부는 각하 시절로 되돌아가는 것 같아 화가 나고 분통이 터진다""",http://www.segye.com/content/html/2024/01/21/20240121508853.html,Y
20240121,윤건영,세계일보,"민주당, 강성희 강제퇴장에 ""경호 빙자 폭력…尹 사과해야"" 총공세","그는 ""언론은 과잉 경호라고 하는데 이건 엄격한 불법 행위""라며 ""경호상 위해라는 것도 완전히 거짓 해명이다. 경호를 빙자해 폭력을 행사한 것으로, 당시 경호 요원 처벌도 수반돼야 한다""고 했다.
문재인 정부 청와대 국정상황실장 출신인 윤건영 의원은 ""오늘 회견 전 문재인 정부 경호처 관련자들에게 확인하니 당시엔 단 한 번도 이런 사례가 없었다고 한다""며 ""백번 양보해 행사 진행에 지장이 있었다고 해도 행사 주최 측이나 의전비서관실에서 나섰어야 했다""고 지적했다.
이어 ""윤 대통령이 강 의원이 들려 나가는 것을 현장에서 목도하지 않았느냐""며 ""그 장면을 봤다면 저지하는 게 대한민국 대통령""이라고 꼬집었다.","문재인 정부 청와대 국정상황실장 출신인 윤건영 의원은 ""오늘 회견 전 문재인 정부 경호처 관련자들에게 확인하니 당시엔 단 한 번도 이런 사례가 없었다고 한다""며 ""백번 양보해 행사 진행에 지장이 있었다고 해도 행사 주최 측이나 의전비서관실에서 나섰어야 했다""고 지적했다  이어 ""윤 대통령이 강 의원이 들려 나가는 것을 현장에서 목도하지 않았느냐""며 ""그 장면을 봤다면 저지하는 게 대한민국 대통령""이라고 꼬집었다","""오늘 회견 전 문재인 정부 경호처 관련자들에게 확인하니 당시엔 단 한 번도 이런 사례가 없었다고 한다""  ""백번 양보해 행사 진행에 지장이 있었다고 해도 행사 주최 측이나 의전비서관실에서 나섰어야 했다""  ""윤 대통령이 강 의원이 들려 나가는 것을 현장에서 목도하지 않았느냐""  ""그 장면을 봤다면 저지하는 게 대한민국 대통령""",http://www.segye.com/content/html/2024/01/21/20240121505322.html,Y
20240122,윤건영,문화일보,"민주, ‘강성희 강제퇴장’ 연일 규탄…“2024년 대한민국 맞나”","박주민 민주당 원내수석부대표는 21일 국회 원내대표회의실에서 기자간담회를 열고 ""당시 영상과 상황을 보면서 과연 이것이 2024년의 대한민국이 맞는지 스스로 계속 반문할 수밖에 없다""며 ""저 상황에 다른 대통령을 대입해보면 좋겠다. 민주당은 이 부분에 대해 강력히 문제를 제기할 수밖에 없고, 대통령 사과와 경호처장 경질까지 가야 하는 사안""이라고 말했다. 이날 기자간담회에는 박 원내수석부대표를 비롯해 김수흥·윤건영·윤준병 민주당 의원, 윤영덕 민주당 원내대변인 등이 참석했다.
윤건영 의원은 ""역대 정부는 진보든 보수든 통의 안전을 보장하면서 국민과의 소통을 보장하는 ‘열린 경호’를 표방했다""며 ""‘각하 시절’로 되돌아간 것 같아서 대단히 화가 난다""고 했다. 강 의원이 강제 퇴장될 당시 현장에 있던 윤준병 의원도 ""폭력 행위가 경호라는 이유로 정당화될 수 있어야 과잉 경호인데 그런 요건을 전혀 충족하지 않는다. 엄격한 불법행위""라고 강조했다.","윤건영 의원은 ""역대 정부는 진보든 보수든 통의 안전을 보장하면서 국민과의 소통을 보장하는 ‘열린 경호’를 표방했다""며 ""‘각하 시절’로 되돌아간 것 같아서 대단히 화가 난다""고 했다","""역대 정부는 진보든 보수든 통의 안전을 보장하면서 국민과의 소통을 보장하는 ‘열린 경호’를 표방했다""",http://www.munhwa.com/news/view.html?no=2024012201039910272006,Y
20240130,윤건영,문화일보,민주당 복당 간보는 이언주… 홍익표 “불출마” 요구에도 중·성동갑 나가나,"최근 국민의힘을 탈당한 이언주(사진) 전 의원의 더불어민주당 복당 결심이 늦어지면서 그 배경에 관심이 쏠리고 있다. 친문(친문재인)계를 중심으로 거센 반발이 나오는 가운데 복당 이후 출마 지역구를 놓고도 설왕설래가 이어지는 모습이다.
이 전 의원은 30일 문화일보와 통화에서 ""윤석열 정권이 ‘가짜 보수’라는 걸 절감한 중도층의 표심을 내가 흡수해야 한다""고 주장했다. 이어 그는 ""당에서도 무당파의 ‘반윤(반윤석열) 정서’를 대변하는 스피커 역할을 해주길 바라고 있다""고 밝혔다. 하지만 과거 ‘친문 주류’에 반발해 탈당한 후 문재인 정부와도 줄곧 각을 세운 탓에 친문계는 이 전 의원의 복당을 부정적으로 바라보고 있다. 친문 핵심인 윤건영 민주당 의원은 이날 KBS 라디오에 출연해 ""나뭇가지가 한쪽으로만 치우치면 부서지기 쉽지 않냐""고 에둘러 비판했다.","친문 핵심인 윤건영 민주당 의원은 이날 KBS 라디오에 출연해 ""나뭇가지가 한쪽으로만 치우치면 부서지기 쉽지 않냐""고 에둘러 비판했다","""나뭇가지가 한쪽으로만 치우치면 부서지기 쉽지 않냐""",http://www.munhwa.com/news/view.html?no=2024013001070630173001,Y
20240130,윤건영,문화일보,친문 윤건영 “한동훈의 운동권 청산? 킬러공천 아닌 잡탕공천”,"친문(친문재인)계 핵심인 윤건영 더불어민주당 의원이 30일 야권의 86 세대 운동권을 겨냥한 한동훈 국민의힘 비상대책위원장의 ‘킬러 공천’을 ""잡탕 공천""이라고 비판했다.
윤 의원은 이날 KBS 라디오에 출연해 ""많이 한심하다. 운동권 잡을 게 아니라 물가 잡고 경제 잡는 게 여당이 할 일인데 아직 정신 못 차렸다""며 이같이 지적했다. 윤 의원은 ""586 운동권 출신은 국민의힘에도 많이 있다""며 ""민주당 586은 청산 대상이고 국민의힘 586은 영입 대상이냐. 왜 그런지 한동훈 위원장이 설명해야 한다""고 했다.","윤 의원은 이날 KBS 라디오에 출연해 ""많이 한심하다. 운동권 잡을 게 아니라 물가 잡고 경제 잡는 게 여당이 할 일인데 아직 정신 못 차렸다""며 이같이 지적했다  윤 의원은 ""586 운동권 출신은 국민의힘에도 많이 있다""며 ""민주당 586은 청산 대상이고 국민의힘 586은 영입 대상이냐. 왜 그런지 한동훈 위원장이 설명해야 한다""고 했다","""많이 한심하다. 운동권 잡을 게 아니라 물가 잡고 경제 잡는 게 여당이 할 일인데 아직 정신 못 차렸다""  ""586 운동권 출신은 국민의힘에도 많이 있다""  ""민주당 586은 청산 대상이고 국민의힘 586은 영입 대상이냐. 왜 그런지 한동훈 위원장이 설명해야 한다""",http://www.munhwa.com/news/view.html?no=2024013001039930173001,Y
20240130,윤건영,세계일보,격해지는 ‘친문 vs 친명’ 갈등… 고민정·윤건영 “필패의 길”,"더불어민주당 내 친명(친이재명)계의 친문(친문재인)계를 향한 공격이 거세지는 것과 관련해 고민정 최고위원과 윤건영 의원은 31일 ""민주당 필패의 길""이라고 비판했다. 대표적인 친문계 인사인 고 최고위원과 윤 의원은 친명계의 공격을 ""어리석은 행동"", ""있을 수 없는 일""이라고 지적하며 ‘친문vs친명’ 구도로는 이번 총선에서 이길 수 없다고 강조했다.","대표적인 친문계 인사인 고 최고위원과 윤 의원은 친명계의 공격을 ""어리석은 행동"", ""있을 수 없는 일""이라고 지적하며 ‘친문vs친명’ 구도로는 이번 총선에서 이길 수 없다고 강조했다  대표적인 친문계 인사인 고 최고위원과 윤 의원은 친명계의 공격을 ""어리석은 행동"", ""있을 수 없는 일""이라고 지적하며 ‘친문vs친명’ 구도로는 이번 총선에서 이길 수 없다고 강조했다","""어리석은 행동""",http://www.segye.com/content/html/2024/01/30/20240130516596.html,
20240130,윤건영,세계일보,격해지는 ‘친문 vs 친명’ 갈등… 고민정·윤건영 “필패의 길”,"그는 이어 ""아직은 저한테 출마하지 말라고 얘기를 안 하시는데, 아마 친문 대 친명으로 격화되는 것을 그분들도 원치 않아 하기 때문에 저항하는 것""이라며 ""그 프레임에 빠지는 것은 민주당이 필패하는 길이기 때문에 별로 옳은 방향은 아니라고 생각한다""고 강조했다.
윤 의원도 이날 KBS라디오 ‘전격시사’에 출연해 친명계의 ‘자객 출마’, ‘친문계 밀어내기’ 논란에 대해 ""상식적으로 있을 수 없는 일""이라고 했다.
윤 의원은 ""선거에서 야당의 유일한 힘은 단합이고 단결""이라며 ""친문이다, 친명이다 가르는 뺄셈 정치로는 선거에서 이길 수가 없다""고 목소리를 높였다. 그는 이어 ""뺄셈 정치보다는 덧셈 정치만이 윤석열정부의 일방독주를 멈출 수 있다""며 ""민주당을 중심으로 통합하고 단결하는 게 중요하다""고 말했다.","윤 의원도 이날 KBS라디오 ‘전격시사’에 출연해 친명계의 ‘자객 출마’, ‘친문계 밀어내기’ 논란에 대해 ""상식적으로 있을 수 없는 일""이라고 했다  윤 의원도 이날 KBS라디오 ‘전격시사’에 출연해 친명계의 ‘자객 출마’, ‘친문계 밀어내기’ 논란에 대해 ""상식적으로 있을 수 없는 일""이라고 했다  윤 의원은 ""선거에서 야당의 유일한 힘은 단합이고 단결""이라며 ""친문이다, 친명이다 가르는 뺄셈 정치로는 선거에서 이길 수가 없다""고 목소리를 높였다  그는 이어 ""뺄셈 정치보다는 덧셈 정치만이 윤석열정부의 일방독주를 멈출 수 있다""며 ""민주당을 중심으로 통합하고 단결하는 게 중요하다""고 말했다","""상식적으로 있을 수 없는 일""  ""선거에서 야당의 유일한 힘은 단합이고 단결""  ""친문이다, 친명이다 가르는 뺄셈 정치로는 선거에서 이길 수가 없다""  ""뺄셈 정치보다는 덧셈 정치만이 윤석열정부의 일방독주를 멈출 수 있다""  ""민주당을 중심으로 통합하고 단결하는 게 중요하다""",http://www.segye.com/content/html/2024/01/30/20240130516596.html,
20240131,윤건영,세계일보,"‘허위 인턴 등록’ 윤건영 1심 선고…검찰, 벌금 500만원 구형 [사사건건]","검찰은 지난해 11월 열린 결심공판에서 윤 의원에게 벌금 500만원을 구형했다. 검찰 측은 ""이 사건 범행의 본질은 윤 의원이 개인적으로 관리하는 사적 단체의 운영비 등을 마치 국회 인턴에게 지급하는 것처럼 사무처에 허위등록해 나랏돈을 편취한 사안으로 죄질이 좋지 않다""고 구형 이유를 밝혔다.
반면 윤 의원은 ""사건 당시 나는 백 전 의원과 인턴 채용 문제 관련해 단 한 마디의 대화도 나눈 적이 없다""며 ""현역 재선 의원이었던 백 전 의원과 작은 연구소 기획실장이었던 내가 500만원 편취를 위해 국가를 상대로 사기 범행을 저지를 이유가 없다""며 거듭 혐의를 부인했다.","반면 윤 의원은 ""사건 당시 나는 백 전 의원과 인턴 채용 문제 관련해 단 한 마디의 대화도 나눈 적이 없다""며 ""현역 재선 의원이었던 백 전 의원과 작은 연구소 기획실장이었던 내가 500만원 편취를 위해 국가를 상대로 사기 범행을 저지를 이유가 없다""며 거듭 혐의를 부인했다","""사건 당시 나는 백 전 의원과 인턴 채용 문제 관련해 단 한 마디의 대화도 나눈 적이 없다""  ""현역 재선 의원이었던 백 전 의원과 작은 연구소 기획실장이었던 내가 500만원 편취를 위해 국가를 상대로 사기 범행을 저지를 이유가 없다""",http://www.segye.com/content/html/2024/01/31/20240131507356.html,Y
20240131,윤건영,국민일보,"‘의원실 인턴 허위 등록’ 윤건영 의원, 벌금 500만원","검찰은 윤 의원과 백 전 의원에게 각각 벌금 300만원을 약식 기소했다. 법원은 2021년 11월 윤 의원과 백 전 의원에게 벌금 500만원의 약식명령을 내렸다.
백 전 의원은 이를 받아들였지만, 윤 의원은 약식명령에 불복해 정식 재판을 청구했다. 그는 지난해 11월 결심공판에서 ""인턴 채용 과정에서 제가 한 일은 의원실의 추천을 받아 김씨에게 (일 할) 생각이 있냐고 물어본 게 전부""며 ""사건 당시 백 전 의원과 인턴 채용에 관해 한마디도 나눈 적이 없다""고 혐의를 부인했다.","그는 지난해 11월 결심공판에서 ""인턴 채용 과정에서 제가 한 일은 의원실의 추천을 받아 김씨에게 (일 할) 생각이 있냐고 물어본 게 전부""며 ""사건 당시 백 전 의원과 인턴 채용에 관해 한마디도 나눈 적이 없다""고 혐의를 부인했다","""인턴 채용 과정에서 제가 한 일은 의원실의 추천을 받아 김씨에게 (일 할) 생각이 있냐고 물어본 게 전부""",https://news.kmib.co.kr/article/view.asp?arcid=0019121024&code=61121311&cp=kd,
20240208,윤건영,세계일보,‘조그마한 백’ KBS 앵커에 “몸 사렸다”는 민주…고민정 “참 비루하다”,"고 최고위원은 이를 두고 ""참 비루하다""고 어이없어했다. 대통령 앞에서 단어 하나 제대로 꺼내지 못하는 앵커 모습에 KBS 조직원들이 자괴감을 느꼈을 거라며 ""수신료를 내고 계신 국민들도 이게 공영방송이 맞나 생각했을 것 같아서 참 씁쓸했다""고 그는 강조했다. 이와 함께 ‘매정하게 끊지 못했다’던 윤 대통령 표현에도 ""매정하게 끊지 못해서 뇌물인 것""이라며 ""그걸로 죄의 대가를 치르는 것""이라고 고 최고위원은 부각했다.
같은 당 윤건영 의원도 이날 MBC 라디오 ‘김종배의 시선집중’에 나와 ""오히려 국민의 분노를 조장하는 불난 집에 기름을 끼얹는 그런 대담인 것 같다""고 평가절하했다. 김 여사 명품백 수수 의혹을 ‘정치 공작’으로 규정하는 여당과 대통령실이 국민을 우습게 본다는 주장도 폈다. 윤 의원은 ""국민의 한 사람으로서 대통령이 사과 정도는 할 것 같았다""며 ""사과의 시옷자도 꺼내지 않고, ‘매정하게 하지 못했다’고 이야기하는데 죄를 짓고 아쉽다고 하면 모든 게 끝나느냐""고 반응했다.","윤 의원은 ""국민의 한 사람으로서 대통령이 사과 정도는 할 것 같았다""며 ""사과의 시옷자도 꺼내지 않고, ‘매정하게 하지 못했다’고 이야기하는데 죄를 짓고 아쉽다고 하면 모든 게 끝나느냐""고 반응했다","""사과의 시옷자도 꺼내지 않고, ‘매정하게 하지 못했다’고 이야기하는데 죄를 짓고 아쉽다고 하면 모든 게 끝나느냐""",http://www.segye.com/content/html/2024/02/08/20240208503532.html,Y
